{
  "path": "/fm27-mods/",
  "title": "FM27 Mods — Real Name Fix, Facepacks & Compatibility",
  "description": "FM27 mods checked 30 October 2026: Real Name Fix V2, facepack and logo compatibility, 2D versus 3D kits, and installation checks for the Launch Preview.",
  "h1": "FM27 mods",
  "meta": "Updated 30 October 2026 · Launch Preview · Author-reported compatibility; downloads not tested by this site.",
  "body": "<p><strong>FM27 mods are already appearing during the Launch Preview.</strong> The first practical options are a real names fix and existing graphics packs whose maintainers explicitly support FM27. Check the pack’s own instructions: graphics, database fixes and interface replacements install in different places.</p>\n<h2>What is available now</h2>\n<table>\n<thead><tr><th>Type</th><th>Source checked 30 October 2026</th><th>Compatibility stated by the maintainer</th></tr></thead>\n<tbody>\n<tr><td>Real names fix</td><td><a href='https://sortitoutsi.net/content/78047/fm27-real-name-fix'>sortitoutsi FM27 Real Name Fix V2</a>, updated 30 October</td><td>FM27; author says the included naming and German national-team fixes are save-game compatible.</td></tr>\n<tr><td>Cut-out faces and logos</td><td><a href='https://sortitoutsi.net/graphics'>sortitoutsi graphics downloads</a></td><td>The site’s FM27 notice says these work even when the pack version still reads 2026.XX.</td></tr>\n<tr><td>2D kits</td><td>Same FM27 compatibility notice</td><td>Reported compatible by sortitoutsi. Match the pack’s scope and installation guide to your game.</td></tr>\n<tr><td>3D kits</td><td>Same FM27 compatibility notice</td><td>Not confirmed by the source. Do not treat 2D compatibility as proof for 3D kits.</td></tr>\n<tr><td>Skins and interface changes</td><td><a href='../fm27-skins/'>FM27 skins and installation notes</a></td><td>FM27 releases now exist; some replace game asset bundles rather than using a traditional skins folder.</td></tr>\n</tbody></table>\n<p>This is a source check, not a test of downloaded files in our own game. Follow the linked maintainer pages for the current file, platform support and later corrections. We do not rehost the downloads.</p>\n<h2>FM27 Real Name Fix: where it goes</h2>\n<p>The sortitoutsi fix changes unlicensed award, city, stadium and competition names and addresses Germany’s national-team selection. Its author describes these fixes as save-game compatible. That statement applies to this named fix, not every editor file or database mod.</p>\n<ol>\n<li><strong>Close FM27 and make a backup</strong> of the files you will replace.</li>\n<li><strong>Open your actual FM27 installation.</strong> On Windows Steam, the author’s path ends in <code>Football Manager 27/shared/data/database/db</code>. On macOS Steam it ends in <code>Football Manager 27/fm.app/Contents/PlugIns/game_plugin.bundle/Contents/Resources/shared/data/database/db</code>. Custom library locations can change the earlier part of the path.</li>\n<li><strong>Read the current author instructions.</strong> V2 lists the <code>dbc</code>, <code>edt</code> and <code>lnc</code> folders and says to copy them into each database folder it identifies, rather than only <code>2700</code>.</li>\n<li><strong>Use the current package’s replacement method.</strong> The author’s 29 October clarification says blank files are included to overwrite the older fake-name files. Do not combine that method with a deletion checklist from an older FM edition.</li>\n<li><strong>Check a known affected name in-game.</strong> After a game update, return to the author’s page in case the database directories or fix have changed.</li>\n</ol>\n<p>These paths belong to the installation directory. A facepack or logo guide may instead use a user-data directory; placing every kind of mod in one generic folder is not a valid install method.</p>\n<h2>FM27 logo packs and licensed assets</h2>\n<p>Check what the game already includes first: Sports Interactive confirms official club logos, kits and player photos for the licensed Arkema Première Ligue. A missing badge in Preview is not by itself proof that a graphics pack is broken; some club and player assets still await rights-holder approval.</p>\n<h2>FM27 facepacks, logos and kits: check one change at a time</h2>\n<p>Use the selected pack’s installation instructions, preserve its folder structure and configuration files, and check a club or player the pack actually covers. If the graphics do not appear, use the pack author’s FM27-specific cache or refresh guidance. Do not assume an older edition’s menu or folder layout is unchanged.</p>\n<p>Existing artwork can be reused while other parts of a pack still need attention. In particular, sortitoutsi’s compatibility notice supports cut-out faces, logos and 2D kits but explicitly leaves 3D kits unconfirmed.</p>\n<h2>Before adding editor data or a tool</h2>\n<ul>\n<li>Match the file to FM27 and the game build it supports; an FM26 label is not interchangeable.</li>\n<li>Check whether a new save is required. The real names fix’s save compatibility is not a rule for unrelated custom databases.</li>\n<li>Record any transfer update used with a save before comparing <a href='../fm27-cheap-players/'>player fees</a> or <a href='../fm27-wonderkids/'>wonderkid profiles</a>.</li>\n<li>Back up saves and original game files, then install one change before checking the next.</li>\n</ul>\n<h2>Related FM27 guides</h2>\n<ul>\n<li><a href='../fm27-skins/'>FM27 skins</a> — early releases and the bundle-install distinction.</li>\n<li><a href='../fm27-wonderkids/'>FM27 wonderkids</a> — sourced Preview candidates.</li>\n<li><a href='../fm27-release-date/'>FM27 Preview and release dates</a> — access and save continuity.</li>\n<li><a href='../fm27/'>FM27 guide hub</a>.</li>\n</ul>",
  "sources": [
    [
      "sortitoutsi: FM27 Real Name Fix V2, updated 30 October 2026, including author installation clarifications",
      "https://sortitoutsi.net/content/78047/fm27-real-name-fix"
    ],
    [
      "sortitoutsi graphics: FM27 compatibility notice (read 30 October 2026)",
      "https://sortitoutsi.net/graphics"
    ],
    [
      "Sports Interactive: Launch Preview announcement and provisional-data notice",
      "https://www.footballmanager.com/news/play-football-manager-27-launch-preview-free"
    ],
    [
      "Sports Interactive: licensed Arkema Première Ligue assets",
      "https://www.footballmanager.com/news/arkema-premiere-ligue-fully-licensed-football-manager-27"
    ]
  ],
  "layout": "article",
  "crumbs": [
    [
      "Home",
      "/"
    ],
    [
      "FM27",
      "/fm27/"
    ],
    [
      "Mods",
      ""
    ]
  ],
  "in_guides": false,
  "order": 230
}
