{
  "path": "/secret-rooms/",
  "title": "Sephiria Secret Rooms — How to Find Hidden Rooms (Cracked Walls)",
  "description": "Find hidden rooms by checking cracked dungeon walls, opening them with an attack, and confirming the room on your map.",
  "h1": "Sephiria Secret Rooms (Hidden Rooms)",
  "meta": "Updated 26 October 2026. Practical route and caveats based on the Steam Basic Guide and player reports.",
  "body": "<p>Find <strong>Sephiria secret rooms</strong> by checking dungeon walls for a crack and striking it — that wall check is how the hidden room opens. Inside are supplies (leaves, Artifacts or Tablets, dice, or rare potions), and the finds count toward the Traveler achievement.</p>\n<h2>How to spot cracked walls</h2>\n<ul>\n  <li>Scan dungeon walls for <strong>subtle cracks near the top</strong> — they are small, so sweep each corridor wall once.</li>\n  <li>Walk up and strike the crack. A notification confirms the find.</li>\n  <li>The room then appears on the map without a drawn passage.</li>\n</ul>\n<h2>What’s inside</h2>\n<p>Rewards reported by the community include leaves, Artifacts/Tablets, dice, or rare potions — worth taking even on throwaway floors.</p>\n<h2>Does the map show them?</h2>\n<p>Only after you open one. Cracked walls do not render on the map beforehand, which is why the “hidden room” phrasing fits: you find them by eye, not by minimap.</p>\n<h2>The post-Erma lore room</h2>\n<p>After defeating <a href=\"../bosses/erma/\">Erma</a>, cross the bridge; on the left side of the table in the next room you can <strong>walk under the wall</strong>—no crack required. Players report it as mostly lore.</p>\n<h2>If you cannot find the entrance</h2>\n<ul>\n  <li><strong>The minimap shows nothing:</strong> look at the room walls first. The guide describes the map marker as a result of discovery, not a clue you can follow beforehand.</li>\n  <li><strong>A crack is hard to see:</strong> check the upper edge of the wall, move close, and strike the suspected crack. Use the discovery notification to confirm success.</li>\n  <li><strong>The room is marked but no corridor is drawn:</strong> return to the wall you opened; the guide explicitly notes that the passage does not appear on the map.</li>\n  <li><strong>You are following the post-Erma tip:</strong> use the table-side passage described above. It is a different player-reported secret from the cracked-wall rooms.</li>\n</ul>\n<h2>Quick FAQ</h2>\n<p><strong>How many secret rooms are there?</strong><br/>The “Traveler” achievement records finding one. The Steam guide does not establish a fixed total number of rooms.</p>\n<p><strong>Do they respawn?</strong><br/>The Steam guide does not document respawn behavior; treat each crack as a dungeon find, not a repeatable room.</p>\n<div class=\"note\">The Steam Basic Guide identifies its main content as version 0.7.31 with some updates through 0.7.35. Its cracked-wall instructions are clear, but current room placement and reward pools may differ. Treat the crackless post-Erma room as a separate community report.</div>\n<p>Related: <a href=\"../builds/companion/\">Companion build</a> · <a href=\"../wishing-fountain/\">Wishing Fountain</a> · <a href=\"../builds/\">Builds</a> · <a href=\"../guides/\">All guides</a>.</p>",
  "sources": [
    [
      "Steam Basic Guide · Secret Room (guide states 0.7.31 / 0.7.35 basis)",
      "https://steamcommunity.com/sharedfiles/filedetails/?id=3474238982"
    ],
    [
      "Steam discussion: secrets?",
      "https://steamcommunity.com/app/2436940/discussions/0/596280581879355354/"
    ]
  ],
  "layout": "article",
  "crumbs": [
    [
      "Home",
      "/"
    ],
    [
      "Secret rooms",
      ""
    ]
  ],
  "in_guides": true,
  "guides_label": "Secret rooms",
  "guides_em": "Cracks & lore rooms",
  "home_also": {
    "title": "Secret rooms",
    "em": "Cracked walls & post-Erma lore room"
  },
  "order": 90
}
