{
  "path": "/fm27-skins/",
  "title": "FM27 Skins — Football Manager 27 Skin Index & Install",
  "description": "FM27 skins: none exist before the 10 November launch. The install path, why FM26 skins have to be rebuilt, and which FM26 skins were still shipping fixes in October 2026.",
  "h1": "FM27 skins",
  "meta": "Football Manager 27 skins — install path, cache rules, and what has to be rebuilt for the new interface.",
  "body": "<p>There are no FM27 skins yet, and that is not a gap in this page — it is how skins work. A skin replaces interface panels, so it has to be built against the interface that actually ships. FM27 arrives on 10 November 2026, and Sports Interactive's feature posts specifically call out a clearer interface and smarter navigation. Panels that moved will break layouts that were tuned for FM26.</p>\n<p>What can be done now: know the install path, know why a port is needed, and know which FM26 skins are still being maintained, because those authors are the ones most likely to port.</p>\n<h2>Why FM26 skins will not simply carry over</h2>\n<p>An FM skin is a set of replacement panels and styles for the game's own interface. When the interface changes, the panel files no longer match, and the skin either fails to load or loads with empty or overlapping sections. The version strings tell you how tightly this is coupled: FM26 skins in wide use are still numbered against game builds — ASF Skin for FM26 sits at v26.3.2, Vanta Black Electric shipped as v1.0 for FM26, and skogr's FM26 skin was still receiving bug-fix updates in late October 2026.</p>\n<p>A skin author therefore has two jobs after launch: rebuild the panels against the new layout, and keep rebuilding after each game patch.</p>\n<h2>Where skins and graphics go</h2>\n<p>FM keeps one user-data tree under Documents, created the first time the game launches. FM26 used:</p>\n<ul>\n  <li><strong>Windows:</strong> Documents\\Sports Interactive\\ — then a version-named folder the game creates</li>\n  <li><strong>macOS:</strong> ~/Documents/Sports Interactive/ — same version-named folder</li>\n</ul>\n<p>Inside it, content is split by type — saves, tactics, skins, graphics, cache and editor files each in their own subfolder. FM27 creates its own folder in that tree the first time you launch it; read the exact name off your own disk rather than guessing, because a pack dropped one directory too high is the most common cause of a skin that never shows up.</p>\n<div class='note'>Stale cache is the second most common cause. If a skin or graphics pack installs but does not appear, clear the cache folder and reload the skin with caching off before you assume the download is broken.</div>\n<h2>What a skin changes, and what it cannot</h2>\n<ul>\n  <li><strong>Changes:</strong> panel layout, colours and typography, which attributes and columns you see where, and how much of the match-day interface is on one screen.</li>\n  <li><strong>Does not change:</strong> player data, the match engine, or what your scouts report. A skin is a window, not a database edit.</li>\n  <li><strong>Safe mid-save:</strong> switching skins does not require a new save, because nothing in the save file depends on the interface.</li>\n</ul>\n<h2>Checks before you install any FM27 skin</h2>\n<ul>\n  <li><strong>Version string vs game version.</strong> A skin numbered for a previous major version will not match FM27 panels.</li>\n  <li><strong>Last update date.</strong> An FM26 skin last touched in 2025 is not a candidate for a port.</li>\n  <li><strong>Patch notes.</strong> Good skin threads say which game patch they were rebuilt against. If the thread does not, treat it as untested.</li>\n  <li><strong>Screenshots of the panels you actually use</strong> — squad view, player profile, match day. A home-screen screenshot proves nothing.</li>\n</ul>\n<h2>The FM27 skin watchlist</h2>\n<p>Skins that were still being maintained for FM26 in September and October 2026 are the realistic port candidates. At the time of writing, that group includes skogr (bug-fix update dated 21 October 2026), Vanta Black Electric (v1.0, September 2026) and ASF Skin (v26.3.2), all listed on FM Scout. This page will add each FM27 port with its version string and the date it was checked — and nothing before a port actually exists.</p>\n<h2>Dates that matter for FM27 skins</h2>\n<ul>\n  <li><strong>29 October 2026</strong> — Launch Preview opens; the interface is visible for the first time, so authors can start measuring what moved.</li>\n  <li><strong>10 November 2026</strong> — launch build. Ports can only be built against this or a later patch.</li>\n  <li><strong>Each FM27 patch</strong> — any patch that touches interface panels forces another skin rebuild. This is why dated version strings matter more than star ratings on a download page.</li>\n</ul>\n<h2>What this page will not do</h2>\n<p>No links to files that have not been checked against an FM27 build. No FM26 skin presented as an FM27 skin with a renamed title. No \"best skin\" ranking before at least two skins exist to compare.</p>\n<h2>FM27 index pages</h2>\n<ul>\n  <li><a href='../fm27-wonderkids/'>FM27 wonderkids</a> — shortlist method and the PA bands worth watching.</li>\n  <li><a href='../fm27-tactics/'>FM27 tactics</a> — what Tactical Tweaks change and how a tactic gets listed.</li>\n  <li><a href='../fm27-mods/'>FM27 mods</a> — real names fix, logo and face packs, editor files, and what carries over from FM26.</li>\n  <li><a href='../fm27/'>FM27 guide hub</a> — release dates and the update schedule for all four clusters.</li>\n</ul>\n<p>Site-wide: <a href='../guides/'>all guides</a> · <a href='../about/'>about this site</a>.</p>",
  "sources": [
    [
      "Where FM26 stores saves, skins and graphics",
      "https://filepathgeek.com/posts/football-manager-26-data-location"
    ],
    [
      "FM Scout: Football Manager 2026 skins",
      "https://www.fmscout.com/c-fm26-skins.html"
    ],
    [
      "FM27 key features (Sports Interactive)",
      "https://www.footballmanager.com/fm27/features"
    ],
    [
      "Play Football Manager 27 Launch Preview free",
      "https://www.footballmanager.com/news/play-football-manager-27-launch-preview-free"
    ]
  ],
  "layout": "article",
  "crumbs": [
    [
      "Home",
      "/"
    ],
    [
      "FM27",
      "/fm27/"
    ],
    [
      "Skins",
      ""
    ]
  ],
  "in_guides": false,
  "order": 220
}
