{
  "path": "/fm27-tactics/",
  "title": "FM27 Tactics — Football Manager 27 Tactic Index",
  "description": "FM27 tactics: what Tactical Tweaks change in Football Manager 27, the checks before you download a tactic, and the shapes worth testing from 29 October 2026.",
  "h1": "FM27 tactics",
  "meta": "Updated 30 October 2026 · Launch Preview available · No tactics tested in-game by this site.",
  "body": "<p>FM27's Launch Preview is available now, ahead of the 10 November 2026 release. This guide covers the officially announced tactical changes and a checklist for judging community tactic downloads. We have not run in-game test seasons and do not yet list a verified best tactic.</p>\n<p>The <a href='../fm27-free-play/'>free Launch Preview</a> runs until 3 November at 18:00 GMT. Community results from this build should be labelled Preview results and rechecked after launch.</p>\n<h2>What FM27 changes in the tactic layer</h2>\n<p>Sports Interactive's published feature posts name three changes that affect how you set a team up:</p>\n<ul>\n  <li><strong>Tactical Tweaks</strong> — instructions delivered from the touchline, mid-match, aimed at gaps you spot in the opposition shape.</li>\n  <li><strong>New player instructions</strong> — finer control over how the team attacks the box.</li>\n  <li><strong>Tactical Effectiveness</strong> — SI's feedback layer for whether the shape you picked is doing its job.</li>\n</ul>\n<p>Those three push the game away from \"import a tactic, press continue\". If instructions are meant to change at 60 minutes, a tactic file is a starting shape, not a finished plan.</p>\n<h2>Six checks before you download anyone's tactic</h2>\n<ul>\n  <li><strong>Mentality and pressing</strong> — gegenpress, control and counter are different jobs. A counter tactic advertised as \"best\" usually means \"best with a mid-table side\".</li>\n  <li><strong>Tempo and passing length</strong> — high tempo with short passing and high tempo with direct balls are different teams.</li>\n  <li><strong>Shape plus roles</strong> — a 4-2-3-1 with two attacking full-backs is not the 4-2-3-1 that won someone's league.</li>\n  <li><strong>The squad it was tested with</strong> — a title-winning side proves the tactic works with elite players, and nothing else.</li>\n  <li><strong>Patch number</strong> — FM patches change match behaviour. A tactic tested in the Launch Preview is a preview tactic.</li>\n  <li><strong>Sample size</strong> — ten games is a streak; a season across two leagues is evidence.</li>\n</ul>\n<div class='note'>Listing rule for this page: no tactic goes in without patch number, league, seasons tested and squad tier. If an author cannot supply those four, the tactic stays out however good the screenshot looks.</div>\n<h2>Shapes worth testing first</h2>\n<p>These are starting points, not recommendations. Each one asks a different question of the FM27 match engine:</p>\n<ul>\n  <li><strong>4-2-3-1 high press</strong> — the default modern shape. The question is whether the double pivot still covers the space behind two attacking full-backs.</li>\n  <li><strong>4-3-3 possession</strong> — slow build, high line, one holding midfielder. Tests whether passing patterns still break a mid-block.</li>\n  <li><strong>5-3-2 / 4-4-2 low block</strong> — deep, narrow, counter through two strikers. The cheapest way to survive a stronger league, and the first thing to break when a match engine changes.</li>\n  <li><strong>3-4-2-1 / 3-4-3</strong> — three centre-backs, wing-backs high. Tests whether the wide areas still decide matches.</li>\n</ul>\n<h2>What the FM27 tactic index will contain</h2>\n<p>A published tactic entry needs the following information before it can be compared with another download: tactic name, shape, mentality, pressing style, tempo, passing length, patch version, author, test league, seasons tested, squad tier, and the date it was last checked.</p>\n<p>The field list follows the FM Scout tactic index, which shows those attributes next to each download — a format FM players already know how to read. Entries will be grouped three ways: <strong>elite</strong> (tested with top-six squads), <strong>underdog</strong> (mid-table and below) and <strong>lower league</strong> (semi-pro and amateur). A tactic that wins the Champions League is not the tactic that gets a League Two side promoted.</p>\n<h2>Dates that matter for FM27 tactics</h2>\n<ul>\n  <li><strong>29 October 2026, 18:00 GMT</strong> — Launch Preview opens free on Steam, Epic, the Microsoft Store, Xbox Game Pass and PC Game Pass, every game mode included.</li>\n  <li><strong>3 November 2026, 18:00 GMT</strong> — the free window closes. Pre-purchase at 10% off keeps preview access until launch.</li>\n  <li><strong>10 November 2026</strong> — full launch: PC/Mac, FM27 Console on Xbox and PS5, FM27 Mobile on Netflix, FM27 Touch on Apple Arcade.</li>\n  <li><strong>First post-launch patch</strong> — the patch that meaningfully changes match behaviour is when launch-week tactics need re-testing.</li>\n</ul>\n<h2>What this page will not claim</h2>\n<p>No \"best tactic\" label without a test season behind it. No win-rate screenshot from a save the author cannot describe. No FM26 tactic relabelled as an FM27 tactic: every entry states the patch it was tested on.</p>\n<h2>FM27 index pages</h2>\n<ul>\n  <li><a href='../fm27-wonderkids/'>FM27 wonderkids</a> — shortlist method and the PA bands worth watching.</li>\n  <li><a href='../fm27-skins/'>FM27 skins</a> — install path, cache rules, and what has to be rebuilt for the new interface.</li>\n  <li><a href='../fm27-mods/'>FM27 mods</a> — real names fix, logo and face packs, editor files, and what carries over from FM26.</li>\n  <li><a href='../fm27/'>FM27 guide hub</a> — release dates and the update schedule for all four clusters.</li>\n</ul>\n<p>Site-wide: <a href='../guides/'>all guides</a> · <a href='../about/'>about this site</a>.</p>",
  "sources": [
    ["FM27 key features (Sports Interactive)", "https://www.footballmanager.com/fm27/features"],
    ["Play Football Manager 27 Launch Preview free", "https://www.footballmanager.com/news/play-football-manager-27-launch-preview-free"],
    ["SEGA: FM27 launches across platforms from 10 November", "https://sega.prezly.com/football-manager-27-launches-across-platforms-from-10-november"],
    ["Football Manager 27 on Steam", "https://store.steampowered.com/app/4530370/Football_Manager_27"],
    ["FM Scout FM26 tactics index (structure reference)", "https://www.fmscout.com/f-fm26-tactics-index.html"]
  ],
  "layout": "article",
  "crumbs": [["Home", "/"], ["FM27", "/fm27/"], ["Tactics", ""]],
  "in_guides": false,
  "order": 210
}
