{
  "path": "/builds/companion/",
  "title": "Sephiria Companion Build — Summoner Route (Pets, Ballista, Tablets)",
  "description": "Sephiria companion build: the summoner route — Companion-tagged Artifacts, Ballista, and Tablets on summons, plus Dimensional Pocket carry.",
  "h1": "Sephiria Companion Build",
  "meta": "For sephiria companion build / summoner searches.",
  "body": "<p><strong>sephiria companion build</strong> is a summoner route: stack Companion-tagged Artifacts, run Ballista beside them, and put Tablets on summons so pets soak aggro while you finish elites and bosses. This page is the quick version; the <a href=\"../../builds/\">builds overview</a> covers every theme.</p>\n<h2>Core idea</h2>\n<ul>\n  <li>Prioritize <strong>Companion</strong> family items early (contracts, moles, jellyfish, cushions, etc.). Community clear videos treat “get all companions online” as the first-floor job.</li>\n  <li><strong>Ballista</strong> / mine-crossbow evolutions play like extra companions once mines become seeking drones.</li>\n  <li>Put Tablets and buffs on companions, not on random side DPS tags.</li>\n  <li>Companions are expensive to max—<strong>Dimensional Pocket / Willpower</strong> lines that carry items between runs make the build much smoother.</li>\n</ul>\n<h2>First-floor checklist</h2>\n<ol>\n  <li>Pick a weapon / combo family before the run (see <a href=\"../../weapons/\">weapons</a>).</li>\n  <li>Pre-load <a href=\"../../wishing-fountain/\">Wishing Fountain</a> picks with Companion-family Artifacts once it is unlocked.</li>\n  <li>Grab every Companion-tag item on floor one before anything shiny.</li>\n  <li>Start a <strong>Ballista</strong> or mine-crossbow line as your second tag.</li>\n  <li>Spend Tablets on companion damage or count, not your own DPS.</li>\n</ol>\n<h2>Run habits</h2>\n<ul>\n  <li>Accept Storm Cloud or light fire as secondary only if it supports Ballista/mines—do not dilute five tags.</li>\n  <li>In co-op, companions keep drawing aggro so human players can focus mechanics.</li>\n  <li>After bosses, rebuild adjacency so Companion pieces stay bonded.</li>\n</ul>\n<h2>Common mistakes</h2>\n<ul>\n  <li>Spreading early picks across five families — companions only come online when the family is stacked.</li>\n  <li>Buffing your own damage while pets die — Tablets and level-ups belong on the summons.</li>\n  <li>Ignoring carry lines: without Dimensional Pocket / Willpower progress you rebuild the set every run.</li>\n</ul>\n<h2>Quick FAQ</h2>\n<p><strong>What counts as a Companion item?</strong><br/>Contracts, moles, jellyfish, cushions and similar pet-family Artifacts — anything that spawns or buffs a summon.</p>\n<p><strong>Do companions hold aggro?</strong><br/>Yes — community clears use them as the aggro line while the player finishes elites and bosses; in co-op they do the same job for the whole team.</p>\n<p><strong>Is it good for Hard Mode?</strong><br/>It is one of the themes players carry into <a href=\"../../hard-mode/#roots-retreat\">Root’s Retreat</a> stages; check the <a href=\"../../hard-mode/\">Hard Mode page</a> for what changes.</p>\n<div class=\"note\">Theme-level consensus also appears in 9Puz / SlashSkill “commit to one combo family” advice. Exact item IDs shift with patches—use the Journal and this page’s video sources for current names.</div>\n<p>Parent hub: <a href=\"../\">Builds overview</a>.</p>\n\n<h2>Related Sephiria guides</h2>\n<ul><li><a href=\"../../builds/\">Sephiria builds</a> &mdash; the main builds overview</li><li><a href=\"../../artifacts/\">Artifacts &amp; Tablets</a> &mdash; the Artifact grid this build leans on</li><li><a href=\"../../coop/\">Co-op play guide</a> &mdash; running the pet build in a party</li><li><a href=\"../../wishing-fountain/\">Wishing Fountain</a> &mdash; pre-load Companion-family Artifacts before the run</li><li><a href=\"../../secret-rooms/\">Secret rooms</a> &mdash; find hidden rooms for supplies</li></ul>",
  "sources": [
    [
      "YT Explosive Companion Build",
      "https://www.youtube.com/watch?v=EftqxGiFgbM"
    ],
    [
      "9Puz first build (theme focus)",
      "https://9puz.com/3580-sephiria-first-run/"
    ],
    [
      "SlashSkill weapons & builds",
      "https://www.slashskill.com/sephiria-best-weapons-and-builds-for-1-0-all-6-weapon-types-ranked/"
    ]
  ],
  "layout": "article",
  "crumbs": [
    [
      "Home",
      "/"
    ],
    [
      "Builds",
      "/builds/"
    ],
    [
      "Companion",
      ""
    ]
  ],
  "in_guides": true,
  "guides_label": "Companion build",
  "guides_em": "Summoner route",
  "home_also": {
    "title": "Companion build",
    "em": "Summons / Ballista focus"
  },
  "order": 31
}
