{
  "path": "/hard-mode/",
  "title": "Sephiria Hard Mode Unlock: Finish Chapter 2 → Root’s Retreat",
  "description": "Unlock Sephiria Hard Mode (Root’s Retreat): finish Chapter 2, talk to the village tree, then clear Stage 1 / 15 / 30. Notes the outdated Destiny free-node path.",
  "h1": "Sephiria Hard Mode unlock: Chapter 2 → Root’s Retreat",
  "meta": "For sephiria roots retreat / hard mode / how to unlock hard mode.",
  "body": "<p>Players search <strong>sephiria roots retreat</strong>, <strong>sephiria hard mode</strong>, and <strong>how to unlock hard mode</strong> because Hard Mode is gated and still listed under the Root’s Retreat achievement names.</p>\n<h2>Current unlock (post Update 0.7.55)</h2>\n<ol>\n  <li>Finish <strong>Chapter 2</strong> (story progress, not just a random boss).</li>\n  <li>Return to Bunnyville and talk to the <strong>Destiny tree</strong>.</li>\n  <li>Open dialogue topics and select <strong>Hard Mode</strong>.</li>\n</ol>\n<p>After that conversation, Hard Mode / Root’s Retreat becomes available for later runs. You do <em>not</em> need to buy a paid Destiny node on the normal path.</p>\n<h2>Root’s Retreat stage names</h2>\n<p>Steam achievements treat Root’s Retreat as Hard Mode stage clears, not a separate village:</p>\n<ul>\n  <li><strong>Root’s Retreat</strong> — clear Hard Mode Stage 1</li>\n  <li><strong>Root’s Retreat 15</strong> — clear Stage 15</li>\n  <li><strong>Root’s Retreat 30</strong> — clear Stage 30</li>\n</ul>\n<div class=\"note\"><strong>Version trap:</strong> Steam “Basic Guide” and some EA discussions still say Hard Mode is a free node at the bottom of Destiny Inscription. That was true early on; TEAM HORAY moved the regular unlock to the tree dialogue in 0.7.55. If a guide only sends you to Destiny Inscription, treat it as legacy.</div>\n<h2>Legacy / failsafe notes</h2>\n<ul>\n  <li>Very old saves may still see a Destiny Inscription fallback (Steam discussion era / later failsafe patches).</li>\n  <li>If the tree says Hard Mode unlocked but you cannot find the entrance UI, check Sapphire/Destiny menus and restart the hub—community threads report UI lag after unlock.</li>\n</ul>\n<h2>What Hard Mode is for</h2>\n<p>Hard Mode adds tougher dungeon modifiers (community 1.0 writeups list many “elements” / challenge toggles) and is the place people take proven builds after clearing the story route. Talent budget also expands once Hard Mode access is online—exact talent totals can change by patch, so verify in-client.</p>\n<p>Related: <a href=\"../destiny-inscription/\">Destiny Inscription</a> · <a href=\"../builds/\">Builds</a> · <a href=\"../bosses/#final\">Final boss</a>.</p>",
  "sources": [
    [
      "Quest-Knight: Hard Mode freischalten",
      "https://quest-knight.de/2026/08/02/sephiria-hard-mode-freischalten/"
    ],
    [
      "Steam discussion (legacy Destiny node)",
      "https://steamcommunity.com/app/2436940/discussions/0/651440877420466019/"
    ],
    [
      "PixelNitro 1.0 Hard Mode elements overview",
      "https://pixelnitro.com/sephiria-1-0-hard-mode-guide-ultimate-18-elements-checklist-best-tier-30-builds/"
    ],
    [
      "ProdigyGamers achievement list (Root’s Retreat stages)",
      "https://prodigygamers.com/2026/08/06/sephiria-100-achievements-walkthrough-guide/"
    ],
    [
      "Exophase Steam achievements (Root’s Retreat / 15 / 30)",
      "https://www.exophase.com/game/sephiria-steam/achievements/"
    ],
    [
      "YT final boss / hard mode clear",
      "https://www.youtube.com/watch?v=R7rdy_owfbo"
    ]
  ],
  "layout": "article",
  "crumbs": [
    [
      "Home",
      "/"
    ],
    [
      "Hard Mode",
      ""
    ]
  ],
  "in_guides": true,
  "guides_label": "Hard Mode",
  "guides_em": "Unlock Root’s Retreat",
  "home_also": {
    "title": "Hard Mode unlock",
    "em": "Root’s Retreat after Chapter 2"
  },
  "order": 55
}
