{
  "path": "/fm27-wonderkids/",
  "title": "FM27 Wonderkids — Football Manager 27 Shortlist Method",
  "description": "FM27 wonderkids: shortlist criteria for the 29 October Launch Preview, scouting limits, and dated player data once verified in-game.",
  "h1": "FM27 wonderkids",
  "meta": "Football Manager 27 wonderkid shortlist — method first, names when the database ships.",
  "body": "<p>No one has seen the FM27 player database outside Sports Interactive. The game launches on 10 November 2026, and the first build with a browsable database is the free Launch Preview from 29 October. Any page claiming a full FM27 wonderkid list today is either recycling FM26 names or inventing them.</p>\n<p>So this page does the part that can be done in October: define what a wonderkid actually is in FM terms, set the bands a credible shortlist has to be built in, and say exactly when the names land.</p>\n<h2>What FM means by a wonderkid</h2>\n<p>FM rates every player twice. <strong>Current Ability (CA)</strong> is what the player is now. <strong>Potential Ability (PA)</strong> is the ceiling he can reach given the right minutes, training and staff. A wonderkid is the gap between those two numbers at a young age: high PA, low CA, and a development curve that pays off inside your save.</p>\n<p>That definition changes what you are shopping for. The target is not the best young player in the game — it is the cheapest player whose ceiling your club can actually reach, and who will still be at your club when he gets there.</p>\n<h2>Why an FM27 list cannot exist yet</h2>\n<ul>\n  <li><strong>The database ships with the game.</strong> SI's pre-launch material covers features, platforms and licensing, not player ratings. No attribute data is public before the Launch Preview.</li>\n  <li><strong>The Launch Preview is the first real look</strong> — 29 October to 3 November, free on Steam, Epic, the Microsoft Store and Game Pass, all game modes included. Saves started there continue into launch.</li>\n  <li><strong>The scale is large.</strong> FM Scout's FM26 wonderkid list reached roughly 940 names by its fourth revision, and was still being updated in June 2026. A single pass at launch does not produce a good list.</li>\n</ul>\n<h2>How the FM27 shortlist will be built</h2>\n<p>Every entry will be checked in-game, not copied from a transfer rumour. The build rules:</p>\n<ul>\n  <li><strong>Age window first.</strong> The list only takes players young enough to develop inside a normal save. Older \"wonderkids\" are just good players.</li>\n  <li><strong>PA band, not a single number.</strong> Star ratings are relative to your own squad, so an entry records the scout band alongside the club it was read at.</li>\n  <li><strong>Reachability.</strong> Fee and wage expectations at save start, against the league reputation of the buying club. A 170-PA striker nobody can sign is trivia, not a recommendation.</li>\n  <li><strong>Position and role.</strong> A wonderkid centre-back and a wonderkid winger are different investments, so they will not share one ranking.</li>\n  <li><strong>League spread.</strong> The list deliberately covers second tiers and smaller football countries, because that is where the price gap is.</li>\n</ul>\n<div class='note'>Fields carried on every entry: name, age, club, position, PA band as read at a named club, fee range at save start, contract length, and the patch the entry was checked on. An entry without a patch number is out of date by definition.</div>\n<h2>Reading potential before the list lands</h2>\n<p>Three things worth knowing while you scout your own list in the preview:</p>\n<ul>\n  <li><strong>Stars are relative.</strong> A four-star potential at a League Two club is not a four-star potential at a title contender. Judge the band against your squad, not in the abstract.</li>\n  <li><strong>Scout twice, then decide.</strong> Two scouts with different judging ability will disagree; the disagreement is information, not noise.</li>\n  <li><strong>Minutes beat potential.</strong> A high-PA teenager who cannot get games stalls. Squad depth at his position is part of the valuation.</li>\n</ul>\n<h2>Where the value usually sits at launch</h2>\n<p>Historically the first-week bargains come from clubs whose division reputation is below their academy reputation: recently relegated sides, second-tier clubs in strong football countries, and big clubs' reserves where a 19-year-old is fourth choice. The Launch Preview is the moment to check whether that pattern survives the new database.</p>\n<h2>What this page will not do</h2>\n<p>No invented names. No attribute screenshots from another site. No \"FM27 wonderkid\" label on a player only because he is young. If a name is here, it was read in a named build and dated.</p>\n<h2>FM27 index pages</h2>\n<ul>\n  <li><a href='../fm27-tactics/'>FM27 tactics</a> — what Tactical Tweaks change and how a tactic gets listed.</li>\n  <li><a href='../fm27-skins/'>FM27 skins</a> — install path, cache rules, and what has to be rebuilt for the new interface.</li>\n  <li><a href='../fm27-mods/'>FM27 mods</a> — real names fix, logo and face packs, editor files, and what carries over from FM26.</li>\n  <li><a href='../fm27/'>FM27 guide hub</a> — release dates and the update schedule for all four clusters.</li>\n</ul>\n<p>Site-wide: <a href='../guides/'>all guides</a> · <a href='../about/'>about this site</a>.</p>",
  "sources": [
    ["FM Scout: Football Manager 2026 wonderkids", "https://www.fmscout.com/a-football-manager-2026-wonderkids.html"],
    ["Play Football Manager 27 Launch Preview free", "https://www.footballmanager.com/news/play-football-manager-27-launch-preview-free"],
    ["FM27 key features (Sports Interactive)", "https://www.footballmanager.com/fm27/features"],
    ["Football Manager 27 on Steam", "https://store.steampowered.com/app/4530370/Football_Manager_27"]
  ],
  "layout": "article",
  "crumbs": [["Home", "/"], ["FM27", "/fm27/"], ["Wonderkids", ""]],
  "in_guides": false,
  "order": 200
}
